{
	"$schema": "https://json-schema.org/draft/2019-09/schema",
	"$id": "https://raw.githubusercontent.com/krisling049/warcry_data/main/schemas/fighter_schema.json",
	"type": "object",
	"title": "Fighter Schema",
	"required": [
		"_id",
		"subfaction",
		"grand_alliance",
		"movement",
		"name",
		"points",
		"runemarks",
		"toughness",
		"warband",
		"weapons",
		"wounds"
	],
	"properties": {
		"_id": {
			"type": "string",
			"description": "A unique ID for this fighter: 8 lowercase letters or digits, e.g. the start of a uuid4.",
			"pattern": "^[0-9a-z]{8}$",
			"examples": [
				"c0fadcc5"
			]
		},
		"subfaction": {
			"type": "string",
			"description": "If the fighter belongs to a subfaction, their subfaction warband name. Otherwise an empty string",
			"default": "",
			"examples": [
				"Hedrakka's Madmob"
			]
		},
		"grand_alliance": {
			"type": "string",
			"description": "Grand Alliance name, lowercase",
			"enum": [
				"chaos",
				"death",
				"destruction",
				"order"
			],
			"examples": [
				"destruction"
			]
		},
		"movement": {
			"type": "integer",
			"description": "Movement characteristic of the fighter",
			"examples": [
				4
			]
		},
		"name": {
			"type": "string",
			"description": "Name of the fighter as it appears on their profile card",
			"examples": [
				"Savage Orruk Arrowboy"
			]
		},
		"points": {
			"type": "integer",
			"description": "Points value of the fighter",
			"examples": [
				110
			]
		},
		"runemarks": {
			"type": "array",
			"default": [],
			"description": "Runemark names, lowercase. Do not include faction runemarks",
			"items": {
				"type": "string",
				"examples": [
					"destroyer"
				]
			}
		},
		"toughness": {
			"type": "integer",
			"description": "Toughness characteristic of the fighter",
			"examples": [
				3
			]
		},
		"warband": {
			"type": "string",
			"description": "Name of the fighter's faction, as defined by their faction runemark",
			"examples": [
				"Bonesplitterz"
			]
		},
		"weapons": {
			"type": "array",
			"description": "Each attack profile available to the fighter",
			"items": {
				"type": "object",
				"required": [
					"attacks",
					"dmg_crit",
					"dmg_hit",
					"max_range",
					"min_range",
					"runemark",
					"strength"
				],
				"properties": {
					"attacks": {
						"type": "integer",
						"examples": [
							3,
							2
						]
					},
					"dmg_crit": {
						"type": "integer",
						"examples": [
							2,
							3
						]
					},
					"dmg_hit": {
						"type": "integer",
						"examples": [
							1
						]
					},
					"max_range": {
						"type": "integer",
						"examples": [
							1,
							15
						]
					},
					"min_range": {
						"type": "integer",
						"description": "If no minimum range, use 0",
						"examples": [
							0,
							3
						]
					},
					"runemark": {
						"type": "string",
						"description": "Runemark of this weapon profile",
						"examples": [
							"unarmed",
							"ranged"
						]
					},
					"strength": {
						"type": "integer",
						"title": "The strength Schema",
						"examples": [
							3
						]
					}
				},
				"examples": [
					{
						"attacks": 3,
						"dmg_crit": 2,
						"dmg_hit": 1,
						"max_range": 1,
						"min_range": 0,
						"runemark": "unarmed",
						"strength": 3
					},
					{
						"attacks": 2,
						"dmg_crit": 3,
						"dmg_hit": 1,
						"max_range": 15,
						"min_range": 3,
						"runemark": "ranged",
						"strength": 3
					}
				]
			}
		},
		"wounds": {
			"type": "integer",
			"description": "Wounds characteristic of the fighter",
			"examples": [
				15
			]
		}
	},
	"examples": [
		{
			"_id": "c0fadcc5",
			"subfaction": "",
			"grand_alliance": "destruction",
			"movement": 4,
			"name": "Savage Orruk Arrowboy",
			"points": 110,
			"runemarks": [
				"destroyer"
			],
			"toughness": 3,
			"warband": "Bonesplitterz",
			"weapons": [
				{
					"attacks": 3,
					"dmg_crit": 2,
					"dmg_hit": 1,
					"max_range": 1,
					"min_range": 0,
					"runemark": "unarmed",
					"strength": 3
				},
				{
					"attacks": 2,
					"dmg_crit": 3,
					"dmg_hit": 1,
					"max_range": 15,
					"min_range": 3,
					"runemark": "ranged",
					"strength": 3
				}
			],
			"wounds": 15
		}
	]
}