[
    {
        "_id": "a0c2eb9f",
        "name": "Clearblood",
        "warband": "Splintered Fang",
        "subfaction": "",
        "grand_alliance": "chaos",
        "movement": 4,
        "toughness": 3,
        "wounds": 10,
        "weapons": [
            {
                "attacks": 4,
                "dmg_crit": 3,
                "dmg_hit": 1,
                "max_range": 1,
                "min_range": 0,
                "runemark": "dagger",
                "strength": 3
            }
        ],
        "runemarks": [],
        "points": 65
    },
    {
        "_id": "298c9d36",
        "name": "Clearblood with Shield",
        "warband": "Splintered Fang",
        "subfaction": "",
        "grand_alliance": "chaos",
        "movement": 4,
        "toughness": 4,
        "wounds": 10,
        "weapons": [
            {
                "attacks": 3,
                "dmg_crit": 3,
                "dmg_hit": 1,
                "max_range": 1,
                "min_range": 0,
                "runemark": "dagger",
                "strength": 3
            }
        ],
        "runemarks": [
            "bulwark"
        ],
        "points": 65
    },
    {
        "_id": "8eef5146",
        "name": "Serpents",
        "warband": "Splintered Fang",
        "subfaction": "",
        "grand_alliance": "chaos",
        "movement": 6,
        "toughness": 2,
        "wounds": 6,
        "weapons": [
            {
                "attacks": 5,
                "dmg_crit": 4,
                "dmg_hit": 1,
                "max_range": 1,
                "min_range": 0,
                "runemark": "fangs",
                "strength": 3
            }
        ],
        "runemarks": [
            "beast"
        ],
        "points": 90
    },
    {
        "_id": "48930bbc",
        "name": "Venomblood with Blade and Barbed Whip",
        "warband": "Splintered Fang",
        "subfaction": "",
        "grand_alliance": "chaos",
        "movement": 5,
        "toughness": 4,
        "wounds": 10,
        "weapons": [
            {
                "attacks": 3,
                "dmg_crit": 4,
                "dmg_hit": 2,
                "max_range": 1,
                "min_range": 0,
                "runemark": "sword",
                "strength": 3
            },
            {
                "attacks": 4,
                "dmg_crit": 4,
                "dmg_hit": 1,
                "max_range": 3,
                "min_range": 0,
                "runemark": "reach",
                "strength": 3
            }
        ],
        "runemarks": [],
        "points": 95
    },
    {
        "_id": "4e872f9a",
        "name": "Venomblood with Duelling Blades",
        "warband": "Splintered Fang",
        "subfaction": "",
        "grand_alliance": "chaos",
        "movement": 5,
        "toughness": 4,
        "wounds": 10,
        "weapons": [
            {
                "attacks": 4,
                "dmg_crit": 4,
                "dmg_hit": 2,
                "max_range": 1,
                "min_range": 0,
                "runemark": "sword",
                "strength": 3
            }
        ],
        "runemarks": [],
        "points": 95
    },
    {
        "_id": "e75b6a58",
        "name": "Venomblood with Barbed Whip",
        "warband": "Splintered Fang",
        "subfaction": "",
        "grand_alliance": "chaos",
        "movement": 4,
        "toughness": 5,
        "wounds": 10,
        "weapons": [
            {
                "attacks": 4,
                "dmg_crit": 4,
                "dmg_hit": 1,
                "max_range": 3,
                "min_range": 0,
                "runemark": "reach",
                "strength": 4
            }
        ],
        "runemarks": [
            "bulwark"
        ],
        "points": 105
    },
    {
        "_id": "c17299c3",
        "name": "Venomblood with Spear and Shield",
        "warband": "Splintered Fang",
        "subfaction": "",
        "grand_alliance": "chaos",
        "movement": 4,
        "toughness": 5,
        "wounds": 10,
        "weapons": [
            {
                "attacks": 3,
                "dmg_crit": 4,
                "dmg_hit": 2,
                "max_range": 2,
                "min_range": 0,
                "runemark": "spear",
                "strength": 4
            }
        ],
        "runemarks": [
            "bulwark"
        ],
        "points": 105
    },
    {
        "_id": "d52caefd",
        "name": "Pureblood",
        "warband": "Splintered Fang",
        "subfaction": "",
        "grand_alliance": "chaos",
        "movement": 4,
        "toughness": 4,
        "wounds": 12,
        "weapons": [
            {
                "attacks": 4,
                "dmg_crit": 4,
                "dmg_hit": 2,
                "max_range": 1,
                "min_range": 0,
                "runemark": "dagger",
                "strength": 4
            }
        ],
        "runemarks": [
            "brute"
        ],
        "points": 115
    },
    {
        "_id": "141590d5",
        "name": "Serpent Caller",
        "warband": "Splintered Fang",
        "subfaction": "",
        "grand_alliance": "chaos",
        "movement": 5,
        "toughness": 4,
        "wounds": 15,
        "weapons": [
            {
                "attacks": 4,
                "dmg_crit": 4,
                "dmg_hit": 2,
                "max_range": 2,
                "min_range": 0,
                "runemark": "fangs",
                "strength": 4
            },
            {
                "attacks": 2,
                "dmg_crit": 4,
                "dmg_hit": 2,
                "max_range": 8,
                "min_range": 0,
                "runemark": "ranged",
                "strength": 4
            }
        ],
        "runemarks": [
            "mystic"
        ],
        "points": 145
    },
    {
        "_id": "58c9475c",
        "name": "Trueblood",
        "warband": "Splintered Fang",
        "subfaction": "",
        "grand_alliance": "chaos",
        "movement": 4,
        "toughness": 4,
        "wounds": 20,
        "weapons": [
            {
                "attacks": 4,
                "dmg_crit": 5,
                "dmg_hit": 2,
                "max_range": 2,
                "min_range": 0,
                "runemark": "spear",
                "strength": 4
            }
        ],
        "runemarks": [
            "hero"
        ],
        "points": 170
    }
]