[
    {
        "_id": "39ee76bf",
        "name": "Initiate with Flameburst Pot",
        "warband": "Scions of the Flame",
        "subfaction": "",
        "grand_alliance": "chaos",
        "movement": 4,
        "toughness": 3,
        "wounds": 10,
        "weapons": [
            {
                "attacks": 3,
                "dmg_crit": 4,
                "dmg_hit": 1,
                "max_range": 1,
                "min_range": 0,
                "runemark": "dagger",
                "strength": 3
            }
        ],
        "runemarks": [
            "trapper"
        ],
        "points": 65
    },
    {
        "_id": "53e6f9b9",
        "name": "Initiate with Morning Star",
        "warband": "Scions of the Flame",
        "subfaction": "",
        "grand_alliance": "chaos",
        "movement": 4,
        "toughness": 3,
        "wounds": 10,
        "weapons": [
            {
                "attacks": 3,
                "dmg_crit": 4,
                "dmg_hit": 1,
                "max_range": 3,
                "min_range": 0,
                "runemark": "reach",
                "strength": 3
            }
        ],
        "runemarks": [],
        "points": 65
    },
    {
        "_id": "0763fc24",
        "name": "Initiate with Brazier Weapon",
        "warband": "Scions of the Flame",
        "subfaction": "",
        "grand_alliance": "chaos",
        "movement": 4,
        "toughness": 3,
        "wounds": 10,
        "weapons": [
            {
                "attacks": 3,
                "dmg_crit": 4,
                "dmg_hit": 1,
                "max_range": 1,
                "min_range": 0,
                "runemark": "axe",
                "strength": 4
            }
        ],
        "runemarks": [
            "trapper"
        ],
        "points": 70
    },
    {
        "_id": "4ec6ae25",
        "name": "Initiate with Hooked Axe",
        "warband": "Scions of the Flame",
        "subfaction": "",
        "grand_alliance": "chaos",
        "movement": 4,
        "toughness": 3,
        "wounds": 10,
        "weapons": [
            {
                "attacks": 4,
                "dmg_crit": 4,
                "dmg_hit": 1,
                "max_range": 1,
                "min_range": 0,
                "runemark": "axe",
                "strength": 3
            }
        ],
        "runemarks": [],
        "points": 70
    },
    {
        "_id": "5e849cc1",
        "name": "Fireborn with Sunblade and Kris",
        "warband": "Scions of the Flame",
        "subfaction": "",
        "grand_alliance": "chaos",
        "movement": 4,
        "toughness": 4,
        "wounds": 12,
        "weapons": [
            {
                "attacks": 4,
                "dmg_crit": 5,
                "dmg_hit": 2,
                "max_range": 1,
                "min_range": 0,
                "runemark": "sword",
                "strength": 3
            }
        ],
        "runemarks": [],
        "points": 95
    },
    {
        "_id": "89ae9d7f",
        "name": "Fireborn with Sunblade and Brazier Axe",
        "warband": "Scions of the Flame",
        "subfaction": "",
        "grand_alliance": "chaos",
        "movement": 4,
        "toughness": 4,
        "wounds": 12,
        "weapons": [
            {
                "attacks": 4,
                "dmg_crit": 4,
                "dmg_hit": 2,
                "max_range": 1,
                "min_range": 0,
                "runemark": "axe",
                "strength": 4
            }
        ],
        "runemarks": [],
        "points": 105
    },
    {
        "_id": "c398eaa8",
        "name": "Fireborn",
        "warband": "Scions of the Flame",
        "subfaction": "",
        "grand_alliance": "chaos",
        "movement": 4,
        "toughness": 4,
        "wounds": 12,
        "weapons": [
            {
                "attacks": 4,
                "dmg_crit": 4,
                "dmg_hit": 2,
                "max_range": 1,
                "min_range": 0,
                "runemark": "axe",
                "strength": 4
            }
        ],
        "runemarks": [
            "trapper"
        ],
        "points": 110
    },
    {
        "_id": "51a7d96c",
        "name": "Inferno Priest",
        "warband": "Scions of the Flame",
        "subfaction": "",
        "grand_alliance": "chaos",
        "movement": 4,
        "toughness": 4,
        "wounds": 15,
        "weapons": [
            {
                "attacks": 3,
                "dmg_crit": 4,
                "dmg_hit": 2,
                "max_range": 2,
                "min_range": 0,
                "runemark": "club",
                "strength": 4
            },
            {
                "attacks": 3,
                "dmg_crit": 4,
                "dmg_hit": 2,
                "max_range": 6,
                "min_range": 0,
                "runemark": "blast",
                "strength": 3
            }
        ],
        "runemarks": [
            "mystic"
        ],
        "points": 120
    },
    {
        "_id": "40a57ff3",
        "name": "Immolator",
        "warband": "Scions of the Flame",
        "subfaction": "",
        "grand_alliance": "chaos",
        "movement": 5,
        "toughness": 4,
        "wounds": 18,
        "weapons": [
            {
                "attacks": 4,
                "dmg_crit": 5,
                "dmg_hit": 2,
                "max_range": 1,
                "min_range": 0,
                "runemark": "unarmed",
                "strength": 4
            }
        ],
        "runemarks": [
            "destroyer"
        ],
        "points": 150
    },
    {
        "_id": "d96f656f",
        "name": "Brazen Champion",
        "warband": "Scions of the Flame",
        "subfaction": "",
        "grand_alliance": "chaos",
        "movement": 4,
        "toughness": 4,
        "wounds": 18,
        "weapons": [
            {
                "attacks": 3,
                "dmg_crit": 6,
                "dmg_hit": 3,
                "max_range": 2,
                "min_range": 0,
                "runemark": "axe",
                "strength": 5
            }
        ],
        "runemarks": [
            "brute"
        ],
        "points": 165
    },
    {
        "_id": "21f028de",
        "name": "Blazing Lord",
        "warband": "Scions of the Flame",
        "subfaction": "",
        "grand_alliance": "chaos",
        "movement": 4,
        "toughness": 5,
        "wounds": 20,
        "weapons": [
            {
                "attacks": 4,
                "dmg_crit": 6,
                "dmg_hit": 2,
                "max_range": 2,
                "min_range": 0,
                "runemark": "sword",
                "strength": 5
            }
        ],
        "runemarks": [
            "hero",
            "brute"
        ],
        "points": 200
    }
]