[
    {
        "_id": "3a603d57",
        "name": "Defacer with Antithete Bow",
        "warband": "Jade Obelisk",
        "subfaction": "",
        "grand_alliance": "chaos",
        "movement": 4,
        "toughness": 4,
        "wounds": 10,
        "weapons": [
            {
                "attacks": 3,
                "dmg_crit": 3,
                "dmg_hit": 1,
                "max_range": 1,
                "min_range": 0,
                "runemark": "dagger",
                "strength": 3
            },
            {
                "attacks": 2,
                "dmg_crit": 3,
                "dmg_hit": 1,
                "max_range": 15,
                "min_range": 3,
                "runemark": "ranged",
                "strength": 3
            }
        ],
        "runemarks": [],
        "points": 95
    },
    {
        "_id": "0107090d",
        "name": "Defacer with Stonecutter Tools",
        "warband": "Jade Obelisk",
        "subfaction": "",
        "grand_alliance": "chaos",
        "movement": 4,
        "toughness": 4,
        "wounds": 10,
        "weapons": [
            {
                "attacks": 4,
                "dmg_crit": 3,
                "dmg_hit": 2,
                "max_range": 1,
                "min_range": 0,
                "runemark": "hammer",
                "strength": 4
            }
        ],
        "runemarks": [
            "warrior"
        ],
        "points": 95
    },
    {
        "_id": "0f01b0fc",
        "name": "Desecrator with Iconoclast Warpick",
        "warband": "Jade Obelisk",
        "subfaction": "",
        "grand_alliance": "chaos",
        "movement": 3,
        "toughness": 4,
        "wounds": 12,
        "weapons": [
            {
                "attacks": 4,
                "dmg_crit": 5,
                "dmg_hit": 2,
                "max_range": 1,
                "min_range": 0,
                "runemark": "hammer",
                "strength": 5
            }
        ],
        "runemarks": [
            "destroyer"
        ],
        "points": 100
    },
    {
        "_id": "5d2df80c",
        "name": "Desecrator with Statue-Smasher Hammer",
        "warband": "Jade Obelisk",
        "subfaction": "",
        "grand_alliance": "chaos",
        "movement": 3,
        "toughness": 4,
        "wounds": 12,
        "weapons": [
            {
                "attacks": 3,
                "dmg_crit": 5,
                "dmg_hit": 3,
                "max_range": 1,
                "min_range": 0,
                "runemark": "hammer",
                "strength": 5
            }
        ],
        "runemarks": [
            "destroyer"
        ],
        "points": 100
    },
    {
        "_id": "6b58ba77",
        "name": "Idolarc",
        "warband": "Jade Obelisk",
        "subfaction": "",
        "grand_alliance": "chaos",
        "movement": 8,
        "toughness": 3,
        "wounds": 8,
        "weapons": [
            {
                "attacks": 3,
                "dmg_crit": 3,
                "dmg_hit": 1,
                "max_range": 1,
                "min_range": 0,
                "runemark": "claws",
                "strength": 3
            }
        ],
        "runemarks": [
            "beast",
            "fly"
        ],
        "points": 105
    },
    {
        "_id": "be116cfc",
        "name": "Nephrite Priestess",
        "warband": "Jade Obelisk",
        "subfaction": "",
        "grand_alliance": "chaos",
        "movement": 4,
        "toughness": 3,
        "wounds": 20,
        "weapons": [
            {
                "attacks": 4,
                "dmg_crit": 4,
                "dmg_hit": 1,
                "max_range": 1,
                "min_range": 0,
                "runemark": "dagger",
                "strength": 3
            }
        ],
        "runemarks": [
            "hero",
            "priest"
        ],
        "points": 105
    },
    {
        "_id": "6095fdfa",
        "name": "Obelisk Bearer",
        "warband": "Jade Obelisk",
        "subfaction": "",
        "grand_alliance": "chaos",
        "movement": 3,
        "toughness": 4,
        "wounds": 20,
        "weapons": [
            {
                "attacks": 4,
                "dmg_crit": 4,
                "dmg_hit": 2,
                "max_range": 1,
                "min_range": 0,
                "runemark": "sword",
                "strength": 4
            }
        ],
        "runemarks": [
            "icon-bearer"
        ],
        "points": 110
    }
]