[
    {
        "_id": "bb658018",
        "name": "Plaguebearer",
        "warband": "Maggotkin of Nurgle: Daemons",
        "subfaction": "",
        "grand_alliance": "chaos",
        "movement": 3,
        "toughness": 4,
        "wounds": 10,
        "weapons": [
            {
                "attacks": 3,
                "dmg_crit": 4,
                "dmg_hit": 1,
                "max_range": 1,
                "min_range": 0,
                "runemark": "sword",
                "strength": 3
            }
        ],
        "runemarks": [
            "warrior"
        ],
        "points": 60
    },
    {
        "_id": "68ef25a4",
        "name": "Plagueridden",
        "warband": "Maggotkin of Nurgle: Daemons",
        "subfaction": "",
        "grand_alliance": "chaos",
        "movement": 3,
        "toughness": 4,
        "wounds": 15,
        "weapons": [
            {
                "attacks": 4,
                "dmg_crit": 4,
                "dmg_hit": 2,
                "max_range": 1,
                "min_range": 0,
                "runemark": "sword",
                "strength": 3
            }
        ],
        "runemarks": [
            "hero",
            "warrior"
        ],
        "points": 90
    },
    {
        "_id": "64aee8cd",
        "name": "Nurglings",
        "warband": "Maggotkin of Nurgle: Daemons",
        "subfaction": "",
        "grand_alliance": "chaos",
        "movement": 5,
        "toughness": 3,
        "wounds": 20,
        "weapons": [
            {
                "attacks": 6,
                "dmg_crit": 3,
                "dmg_hit": 1,
                "max_range": 1,
                "min_range": 0,
                "runemark": "sword",
                "strength": 3
            }
        ],
        "runemarks": [
            "minion"
        ],
        "points": 115
    },
    {
        "_id": "384d1420",
        "name": "Poxbringer",
        "warband": "Maggotkin of Nurgle: Daemons",
        "subfaction": "",
        "grand_alliance": "chaos",
        "movement": 3,
        "toughness": 4,
        "wounds": 20,
        "weapons": [
            {
                "attacks": 4,
                "dmg_crit": 5,
                "dmg_hit": 2,
                "max_range": 1,
                "min_range": 0,
                "runemark": "sword",
                "strength": 4
            },
            {
                "attacks": 2,
                "dmg_crit": 6,
                "dmg_hit": 3,
                "max_range": 7,
                "min_range": 3,
                "runemark": "blast",
                "strength": 3
            }
        ],
        "runemarks": [
            "hero"
        ],
        "points": 130
    },
    {
        "_id": "04b82f5a",
        "name": "Sloppity Bilepiper",
        "warband": "Maggotkin of Nurgle: Daemons",
        "subfaction": "",
        "grand_alliance": "chaos",
        "movement": 4,
        "toughness": 4,
        "wounds": 20,
        "weapons": [
            {
                "attacks": 3,
                "dmg_crit": 4,
                "dmg_hit": 2,
                "max_range": 1,
                "min_range": 0,
                "runemark": "sword",
                "strength": 4
            }
        ],
        "runemarks": [
            "hero",
            "agile"
        ],
        "points": 130
    },
    {
        "_id": "f252c741",
        "name": "Spoilpox Scrivener",
        "warband": "Maggotkin of Nurgle: Daemons",
        "subfaction": "",
        "grand_alliance": "chaos",
        "movement": 3,
        "toughness": 4,
        "wounds": 22,
        "weapons": [
            {
                "attacks": 2,
                "dmg_crit": 5,
                "dmg_hit": 3,
                "max_range": 2,
                "min_range": 0,
                "runemark": "fangs",
                "strength": 5
            }
        ],
        "runemarks": [
            "hero",
            "champion"
        ],
        "points": 135
    },
    {
        "_id": "872ffe2e",
        "name": "Beast of Nurgle",
        "warband": "Maggotkin of Nurgle: Daemons",
        "subfaction": "",
        "grand_alliance": "chaos",
        "movement": 4,
        "toughness": 4,
        "wounds": 30,
        "weapons": [
            {
                "attacks": 4,
                "dmg_crit": 4,
                "dmg_hit": 2,
                "max_range": 1,
                "min_range": 0,
                "runemark": "claws",
                "strength": 4
            }
        ],
        "runemarks": [
            "beast",
            "ferocious"
        ],
        "points": 150
    },
    {
        "_id": "67ae7666",
        "name": "Plague Drone",
        "warband": "Maggotkin of Nurgle: Daemons",
        "subfaction": "",
        "grand_alliance": "chaos",
        "movement": 6,
        "toughness": 4,
        "wounds": 30,
        "weapons": [
            {
                "attacks": 4,
                "dmg_crit": 4,
                "dmg_hit": 2,
                "max_range": 1,
                "min_range": 0,
                "runemark": "sword",
                "strength": 4
            }
        ],
        "runemarks": [
            "fly",
            "destroyer"
        ],
        "points": 205
    },
    {
        "_id": "f3ef89d8",
        "name": "Plaguebringer",
        "warband": "Maggotkin of Nurgle: Daemons",
        "subfaction": "",
        "grand_alliance": "chaos",
        "movement": 6,
        "toughness": 4,
        "wounds": 35,
        "weapons": [
            {
                "attacks": 5,
                "dmg_crit": 4,
                "dmg_hit": 2,
                "max_range": 1,
                "min_range": 0,
                "runemark": "sword",
                "strength": 4
            }
        ],
        "runemarks": [
            "fly",
            "hero",
            "destroyer"
        ],
        "points": 255
    }
]