[
    {
        "_id": "w82oy9ke",
        "name": "Twistroot Warden with Spitespear",
        "warband": "Twistweald",
        "subfaction": "",
        "grand_alliance": "order",
        "movement": 4,
        "toughness": 5,
        "wounds": 12,
        "weapons": [
            {
                "attacks": 4,
                "dmg_crit": 4,
                "dmg_hit": 2,
                "max_range": 2,
                "min_range": 0,
                "runemark": "spear",
                "strength": 4
            }
        ],
        "runemarks": [],
        "points": 115
    },
    {
        "_id": "yj5dkhz9",
        "name": "Twistroot Revenant with Harvester Blade",
        "warband": "Twistweald",
        "subfaction": "",
        "grand_alliance": "order",
        "movement": 4,
        "toughness": 4,
        "wounds": 12,
        "weapons": [
            {
                "attacks": 4,
                "dmg_crit": 5,
                "dmg_hit": 2,
                "max_range": 1,
                "min_range": 0,
                "runemark": "sword",
                "strength": 4
            }
        ],
        "runemarks": [
            "destroyer"
        ],
        "points": 105
    },
    {
        "_id": "t6gzalfu",
        "name": "Twistroot Spite-revenant with Briarlash",
        "warband": "Twistweald",
        "subfaction": "",
        "grand_alliance": "order",
        "movement": 4,
        "toughness": 4,
        "wounds": 12,
        "weapons": [
            {
                "attacks": 3,
                "dmg_crit": 3,
                "dmg_hit": 2,
                "max_range": 3,
                "min_range": 0,
                "runemark": "reach",
                "strength": 5
            }
        ],
        "runemarks": [
            "berserker",
            "destroyer"
        ],
        "points": 105
    },
    {
        "_id": "nxy63tdg",
        "name": "Swarmsage",
        "warband": "Twistweald",
        "subfaction": "",
        "grand_alliance": "order",
        "movement": 4,
        "toughness": 4,
        "wounds": 22,
        "weapons": [
            {
                "attacks": 4,
                "dmg_crit": 5,
                "dmg_hit": 2,
                "max_range": 3,
                "min_range": 0,
                "runemark": "reach",
                "strength": 4
            },
            {
                "attacks": 2,
                "dmg_crit": 6,
                "dmg_hit": 3,
                "max_range": 7,
                "min_range": 3,
                "runemark": "blast",
                "strength": 4
            }
        ],
        "runemarks": [
            "berserker",
            "hero"
        ],
        "points": 180
    },
    {
        "_id": "0mn9hope",
        "name": "Twistroot Warden with Guardian Bow",
        "warband": "Twistweald",
        "subfaction": "",
        "grand_alliance": "order",
        "movement": 4,
        "toughness": 4,
        "wounds": 12,
        "weapons": [
            {
                "attacks": 2,
                "dmg_crit": 3,
                "dmg_hit": 2,
                "max_range": 1,
                "min_range": 0,
                "runemark": "claws",
                "strength": 3
            },
            {
                "attacks": 4,
                "dmg_crit": 2,
                "dmg_hit": 1,
                "max_range": 15,
                "min_range": 3,
                "runemark": "ranged",
                "strength": 4
            }
        ],
        "runemarks": [],
        "points": 115
    },
    {
        "_id": "olr4u0n9",
        "name": "Twistroot Dryad",
        "warband": "Twistweald",
        "subfaction": "",
        "grand_alliance": "order",
        "movement": 5,
        "toughness": 4,
        "wounds": 10,
        "weapons": [
            {
                "attacks": 4,
                "dmg_crit": 4,
                "dmg_hit": 2,
                "max_range": 1,
                "min_range": 0,
                "runemark": "claws",
                "strength": 4
            }
        ],
        "runemarks": [
            "destroyer"
        ],
        "points": 100
    },
    {
        "_id": "0awo336h",
        "name": "Twistroot Warden with Guardian Halberd",
        "warband": "Twistweald",
        "subfaction": "",
        "grand_alliance": "order",
        "movement": 4,
        "toughness": 4,
        "wounds": 12,
        "weapons": [
            {
                "attacks": 3,
                "dmg_crit": 4,
                "dmg_hit": 3,
                "max_range": 2,
                "min_range": 0,
                "runemark": "axe",
                "strength": 5
            }
        ],
        "runemarks": [],
        "points": 120
    }
]
