[
    {
        "_id": "5fde0ee8",
        "name": "Mirefolk Outcast with Bilewood Weapons",
        "warband": "Rotmire Creed",
        "subfaction": "",
        "grand_alliance": "chaos",
        "movement": 4,
        "toughness": 3,
        "wounds": 10,
        "weapons": [
            {
                "attacks": 4,
                "dmg_crit": 3,
                "dmg_hit": 1,
                "max_range": 1,
                "min_range": 0,
                "runemark": "club",
                "strength": 3
            }
        ],
        "runemarks": [
            "scout"
        ],
        "points": 65
    },
    {
        "_id": "ba18c8ea",
        "name": "Mirefolk Outcast with Bilewood Weapon and Shield",
        "warband": "Rotmire Creed",
        "subfaction": "",
        "grand_alliance": "chaos",
        "movement": 4,
        "toughness": 4,
        "wounds": 10,
        "weapons": [
            {
                "attacks": 3,
                "dmg_crit": 4,
                "dmg_hit": 1,
                "max_range": 2,
                "min_range": 0,
                "runemark": "spear",
                "strength": 3
            }
        ],
        "runemarks": [
            "scout"
        ],
        "points": 75
    },
    {
        "_id": "9eaa12db",
        "name": "Carrion Catcher with Snatcher-hook",
        "warband": "Rotmire Creed",
        "subfaction": "",
        "grand_alliance": "chaos",
        "movement": 4,
        "toughness": 4,
        "wounds": 12,
        "weapons": [
            {
                "attacks": 3,
                "dmg_crit": 4,
                "dmg_hit": 2,
                "max_range": 2,
                "min_range": 0,
                "runemark": "hook",
                "strength": 4
            }
        ],
        "runemarks": [
            "scout",
            "destroyer"
        ],
        "points": 100
    },
    {
        "_id": "1988c69e",
        "name": "Carrion Catcher with Impaler",
        "warband": "Rotmire Creed",
        "subfaction": "",
        "grand_alliance": "chaos",
        "movement": 4,
        "toughness": 4,
        "wounds": 12,
        "weapons": [
            {
                "attacks": 3,
                "dmg_crit": 5,
                "dmg_hit": 2,
                "max_range": 2,
                "min_range": 0,
                "runemark": "scythe",
                "strength": 4
            }
        ],
        "runemarks": [
            "scout"
        ],
        "points": 105
    },
    {
        "_id": "680fcbe7",
        "name": "Bloated one with Raker-claw and Hooked Net",
        "warband": "Rotmire Creed",
        "subfaction": "",
        "grand_alliance": "chaos",
        "movement": 4,
        "toughness": 4,
        "wounds": 18,
        "weapons": [
            {
                "attacks": 4,
                "dmg_crit": 5,
                "dmg_hit": 2,
                "max_range": 1,
                "min_range": 0,
                "runemark": "claws",
                "strength": 4
            }
        ],
        "runemarks": [
            "brute",
            "trapper"
        ],
        "points": 140
    },
    {
        "_id": "d3377614",
        "name": "Bloated One with Raker-claws",
        "warband": "Rotmire Creed",
        "subfaction": "",
        "grand_alliance": "chaos",
        "movement": 4,
        "toughness": 4,
        "wounds": 18,
        "weapons": [
            {
                "attacks": 5,
                "dmg_crit": 5,
                "dmg_hit": 2,
                "max_range": 1,
                "min_range": 0,
                "runemark": "claws",
                "strength": 4
            }
        ],
        "runemarks": [
            "brute"
        ],
        "points": 145
    },
    {
        "_id": "6407f2f9",
        "name": "Witherlord",
        "warband": "Rotmire Creed",
        "subfaction": "",
        "grand_alliance": "chaos",
        "movement": 4,
        "toughness": 4,
        "wounds": 20,
        "weapons": [
            {
                "attacks": 4,
                "dmg_crit": 5,
                "dmg_hit": 3,
                "max_range": 2,
                "min_range": 0,
                "runemark": "hook",
                "strength": 4
            }
        ],
        "runemarks": [
            "hero",
            "destroyer"
        ],
        "points": 175
    }
]