[
    {
        "_id": "05730b23",
        "name": "Iron Legionary",
        "warband": "Iron Golems",
        "subfaction": "",
        "grand_alliance": "chaos",
        "movement": 4,
        "toughness": 5,
        "wounds": 12,
        "weapons": [
            {
                "attacks": 3,
                "dmg_crit": 4,
                "dmg_hit": 1,
                "max_range": 1,
                "min_range": 0,
                "runemark": "club",
                "strength": 3
            }
        ],
        "runemarks": [],
        "points": 75
    },
    {
        "_id": "4d002a1c",
        "name": "Iron Legionary with Bolas",
        "warband": "Iron Golems",
        "subfaction": "",
        "grand_alliance": "chaos",
        "movement": 4,
        "toughness": 4,
        "wounds": 12,
        "weapons": [
            {
                "attacks": 3,
                "dmg_crit": 4,
                "dmg_hit": 1,
                "max_range": 1,
                "min_range": 0,
                "runemark": "hammer",
                "strength": 3
            },
            {
                "attacks": 3,
                "dmg_crit": 3,
                "dmg_hit": 1,
                "max_range": 3,
                "min_range": 0,
                "runemark": "reach",
                "strength": 3
            }
        ],
        "runemarks": [],
        "points": 75
    },
    {
        "_id": "4d8867a5",
        "name": "Iron Legionary with Twin Hammers",
        "warband": "Iron Golems",
        "subfaction": "",
        "grand_alliance": "chaos",
        "movement": 4,
        "toughness": 4,
        "wounds": 12,
        "weapons": [
            {
                "attacks": 4,
                "dmg_crit": 4,
                "dmg_hit": 1,
                "max_range": 1,
                "min_range": 0,
                "runemark": "hammer",
                "strength": 3
            }
        ],
        "runemarks": [],
        "points": 75
    },
    {
        "_id": "dec61d09",
        "name": "Armator",
        "warband": "Iron Golems",
        "subfaction": "",
        "grand_alliance": "chaos",
        "movement": 3,
        "toughness": 4,
        "wounds": 15,
        "weapons": [
            {
                "attacks": 4,
                "dmg_crit": 4,
                "dmg_hit": 2,
                "max_range": 1,
                "min_range": 0,
                "runemark": "hammer",
                "strength": 4
            }
        ],
        "runemarks": [],
        "points": 90
    },
    {
        "_id": "11ffa5a0",
        "name": "Signifer",
        "warband": "Iron Golems",
        "subfaction": "",
        "grand_alliance": "chaos",
        "movement": 4,
        "toughness": 4,
        "wounds": 18,
        "weapons": [
            {
                "attacks": 4,
                "dmg_crit": 4,
                "dmg_hit": 2,
                "max_range": 1,
                "min_range": 0,
                "runemark": "hammer",
                "strength": 4
            }
        ],
        "runemarks": [
            "icon-bearer"
        ],
        "points": 125
    },
    {
        "_id": "adc1715c",
        "name": "Prefector",
        "warband": "Iron Golems",
        "subfaction": "",
        "grand_alliance": "chaos",
        "movement": 4,
        "toughness": 4,
        "wounds": 18,
        "weapons": [
            {
                "attacks": 4,
                "dmg_crit": 5,
                "dmg_hit": 2,
                "max_range": 1,
                "min_range": 0,
                "runemark": "hammer",
                "strength": 4
            }
        ],
        "runemarks": [
            "brute"
        ],
        "points": 135
    },
    {
        "_id": "70b20681",
        "name": "Drillmaster",
        "warband": "Iron Golems",
        "subfaction": "",
        "grand_alliance": "chaos",
        "movement": 5,
        "toughness": 4,
        "wounds": 18,
        "weapons": [
            {
                "attacks": 4,
                "dmg_crit": 4,
                "dmg_hit": 2,
                "max_range": 1,
                "min_range": 0,
                "runemark": "club",
                "strength": 4
            },
            {
                "attacks": 4,
                "dmg_crit": 3,
                "dmg_hit": 2,
                "max_range": 3,
                "min_range": 0,
                "runemark": "reach",
                "strength": 4
            }
        ],
        "runemarks": [
            "berserker"
        ],
        "points": 140
    },
    {
        "_id": "bb0df6f0",
        "name": "Dominar",
        "warband": "Iron Golems",
        "subfaction": "",
        "grand_alliance": "chaos",
        "movement": 4,
        "toughness": 4,
        "wounds": 22,
        "weapons": [
            {
                "attacks": 4,
                "dmg_crit": 5,
                "dmg_hit": 2,
                "max_range": 1,
                "min_range": 0,
                "runemark": "hammer",
                "strength": 5
            }
        ],
        "runemarks": [
            "hero",
            "brute"
        ],
        "points": 170
    },
    {
        "_id": "95f83304",
        "name": "Ogor Breacher",
        "warband": "Iron Golems",
        "subfaction": "",
        "grand_alliance": "chaos",
        "movement": 4,
        "toughness": 5,
        "wounds": 30,
        "weapons": [
            {
                "attacks": 3,
                "dmg_crit": 8,
                "dmg_hit": 4,
                "max_range": 1,
                "min_range": 0,
                "runemark": "unarmed",
                "strength": 6
            }
        ],
        "runemarks": [
            "destroyer"
        ],
        "points": 220
    }
]