[
    {
        "_id": "58c57168",
        "name": "Dire Wolf",
        "warband": "death",
        "subfaction": "",
        "grand_alliance": "death",
        "movement": 8,
        "toughness": 3,
        "wounds": 10,
        "weapons": [
            {
                "attacks": 3,
                "dmg_crit": 3,
                "dmg_hit": 1,
                "max_range": 1,
                "min_range": 0,
                "runemark": "claws",
                "strength": 3
            }
        ],
        "runemarks": [
            "thrall",
            "scout"
        ],
        "points": 85
    },
    {
        "_id": "61bbb21b",
        "name": "Fell Bat",
        "warband": "death",
        "subfaction": "",
        "grand_alliance": "death",
        "movement": 10,
        "toughness": 3,
        "wounds": 12,
        "weapons": [
            {
                "attacks": 3,
                "dmg_crit": 4,
                "dmg_hit": 2,
                "max_range": 1,
                "min_range": 0,
                "runemark": "fangs",
                "strength": 3
            }
        ],
        "runemarks": [
            "fly",
            "thrall",
            "frenzied"
        ],
        "points": 130
    },
    {
        "_id": "cc01fb56",
        "name": "Terrorgheist",
        "warband": "death",
        "subfaction": "",
        "grand_alliance": "death",
        "movement": 12,
        "toughness": 4,
        "wounds": 50,
        "weapons": [
            {
                "attacks": 4,
                "dmg_crit": 8,
                "dmg_hit": 4,
                "max_range": 2,
                "min_range": 0,
                "runemark": "fangs",
                "strength": 5
            }
        ],
        "runemarks": [
            "fly",
            "monster",
            "terrifying"
        ],
        "points": 500
    },
    {
        "_id": "033e033b",
        "name": "Zombie Dragon",
        "warband": "death",
        "subfaction": "",
        "grand_alliance": "death",
        "movement": 12,
        "toughness": 4,
        "wounds": 50,
        "weapons": [
            {
                "attacks": 5,
                "dmg_crit": 8,
                "dmg_hit": 4,
                "max_range": 2,
                "min_range": 0,
                "runemark": "fangs",
                "strength": 5
            }
        ],
        "runemarks": [
            "fly",
            "monster",
            "brute"
        ],
        "points": 540
    }
]